{
  "deviceId": "nvidia-jetson-agx-orin",
  "manufacturer": "NVIDIA",
  "modelName": "NVIDIA Jetson AGX Orin (Developer Kit)",
  "releaseYear": 2022,
  "cpu": {
    "cores": 12,
    "architecture": "aarch64",
    "maxClockMhz": 2000,
    "model": "Arm Cortex-A78AE (64-bit)"
  },
  "memoryMb": 32768,
  "memoryVariantsMb": [32768, 65536],
  "gpu": {
    "present": true,
    "model": "NVIDIA Ampere GPU",
    "cudaCores": 2048,
    "tensorCores": 64,
    "aiTops": 275
  },
  "usb": {
    "ports": [
      { "version": 3, "count": 3 },
      { "version": 2, "count": 2 }
    ]
  },
  "storage": {
    "interfaces": ["emmc", "nvme-m2"],
    "details": "On-module eMMC plus M.2 Key M NVMe (PCIe Gen4) on the developer kit carrier."
  },
  "power": {
    "voltageV": 19,
    "typicalDrawW": 30,
    "maxDrawW": 60,
    "connector": "DC barrel jack (9-20V; ships with a 65W adapter)"
  },
  "supportedImages": [
    "NVIDIA JetPack 5.x (L4T, Ubuntu 20.04 based)",
    "NVIDIA JetPack 6.x (L4T, Ubuntu 22.04 based)"
  ],
  "firmwareCompatibility": {
    "minFirmware": "JetPack 5.x / L4T 35.x",
    "maxFirmware": "JetPack 6.x / L4T 36.x",
    "notes": "JetPack version dictates the supported CUDA/TensorRT stack and kernel."
  },
  "_notes": "aiTops=275 is NVIDIA's stated dense INT8 figure for the 64GB SKU; the 32GB SKU is rated up to 200 TOPS. memoryMb uses 32GB as the representative value; 64GB variant also sold. typicalDrawW=30 is an approximation within the documented 15W-60W configurable power-mode range; exact draw is mode- and workload-dependent. USB port counts reflect the NVIDIA developer-kit carrier board."
}
